{
  "spec": "autotel-eventcatalog-drift-summary/v0.2.0",
  "mode": "all",
  "shouldFail": true,
  "reason": "Drift detected in current snapshot.",
  "counts": {
    "observedButUndocumentedEvents": 1,
    "documentedButUnseenEvents": 1,
    "fieldDriftEvents": 1,
    "fieldDriftPaths": 1,
    "typeDriftPaths": 0,
    "valueDriftPaths": 0,
    "undocumentedServices": 0,
    "undocumentedChannels": 0,
    "total": 3
  }
}
