{
  "spec": "autotel-eventcatalog-drift-summary/v0.2.0",
  "mode": "all",
  "shouldFail": false,
  "reason": "No drift detected.",
  "counts": {
    "observedButUndocumentedEvents": 0,
    "documentedButUnseenEvents": 0,
    "fieldDriftEvents": 0,
    "fieldDriftPaths": 0,
    "typeDriftPaths": 0,
    "valueDriftPaths": 0,
    "undocumentedServices": 0,
    "undocumentedChannels": 0,
    "total": 0
  }
}
